COCKTAILS,,
SPECIAL - COLD PRESSED NEGRONI,"Beefeater London Dry Gin, Cold Pressed Caravan Coffee Campari, Punt E Mes Vermouth",8.7
PEACH BELLINI,"Prosecco, White Peach, Peach Bitters",7
DARK DAQUIRI,"Havana Club Anejo Especial Rum, Angostura Bitters, Lime, Sugar",7.9
BRICK SPRITZ,"Beefeater Strawberry London Gin, Limoncello, Prosecco, Elderflower, Mint, Lime",8.6
BLOODY TOMMY,"Olmeca Resposado Tequila, Blood Orange, Blue Agave Nectar, Lime",8.6
PEACHY BLINDER,"Havana Club Anejo Especial Rum, Wray and Nephew Over-Proof Rum, Peach, Mint, Lime",8.6
MR VALENTINE SOUR,"Bulleit Bourbon, Disaronno, Taylor's LBV Port, Lime, Egg White, Orange Bitters",8.8
ESPRESSO MARTINI,"Absolut Vodka, Kahlua, Caravan Coffee Market Blend Espresso",8.8
BROCKLEY STING,"Chivas Regal 12 Yr Old Scotch, Beefeater London Dry Gin, Honey, Lime, House Ginger Syrup",8.8
PASSION FRUIT & CHILLI MARTINI,"House Infused Chilli Absolut Vodka, Passionfruit, Peach Syrup",8.8
MAPLE OLD FASHIONED,"Wild Turkey 101 Bourbon, Maple Syrup, Angostura Bitters, Orange Twist",9
FRENCH 75,"Louis Boyier Brut Champagne, Beefeater London Dry Gin, Lemon",9.5
BLOOD ORANGE & MINT SLING MOCKTAIL,"Blood Orange, Lemon, Mint, Soda",4
